### ISSUE TITLE
[OpenStack] Errors of pkb.py when it excuted benchmarks

### ISSUE THREAD

**Issue by michael92437558** [GoogleCloudPlatform/PerfKitBenchmarker#819]
vi test.sh
export OS_USERNAME=admin
export OS_PASSWORD=admin
export OS_TENANT_NAME=admin
export OS_PROJECT_NAME=admin
export OS_AUTH_URL=http://172.21.4.2:5000/v2.0

source test.sh
nova list -> succeed
+--------------------------------------+----------------------------------------------+---------+------------+-------------+---------------------------------------------------------------------+
| ID                                   | Name                                         | Status  | Task State | Power State | Networks                                                            |
+--------------------------------------+----------------------------------------------+---------+------------+-------------+---------------------------------------------------------------------+
| 01249794-bfa7-4b21-be99-7f38a7a59cb7 | murano-clmonijmazrklz-gateway-1-rpy22hhl3w7q | ACTIVE  | -          | Running     | kkk-network-dcd0da153ea64e10a399bb50d7f6c451=10.0.6.7, 172.21.4.232 |
| a8ecea03-0820-4651-938f-b79c582240d9 | murano-clmonijmazrklz-kube-1-jb32dpvxxpjw    | ACTIVE  | -          | Running     | kkk-network-dcd0da153ea64e10a399bb50d7f6c451=10.0.6.6, 172.21.4.233 |
| dd2da4e5-5e49-45b3-9b79-799e44635214 | murano-clmonijmazrklz-kube-2-mlkgm22dfgw6    | ACTIVE  | -          | Running     | kkk-network-dcd0da153ea64e10a399bb50d7f6c451=10.0.6.5, 172.21.4.234 |
| 02349f64-be0e-425e-a4f5-991179deaf75 | murano-clmonijmazrklz-kube-3-h23riiwgkede    | ACTIVE  | -          | Running     | kkk-network-dcd0da153ea64e10a399bb50d7f6c451=10.0.6.4, 172.21.4.230 |
| 6f73bf01-fe76-4e90-a7c7-128778e4c586 | qemu-agent-base-image                        | ACTIVE  | -          | Running     | net04=192.168.111.229, 172.21.4.212                                 |
| 8ac91c7d-8ac3-4ba0-93bf-e34869fd98d6 | test                                         | SHUTOFF | -          | Shutdown    | net04_ext=172.21.4.190; net04=192.168.111.61                        |
| ea1e7e40-5aef-4468-8dee-4fe4b54616cd | test11                                       | ACTIVE  | -          | Running     | net04=192.168.111.225; net04_ext=172.21.4.239                       |
+--------------------------------------+----------------------------------------------+---------+------------+-------------+---------------------------------------------------------------------+

and tcpdump has captured each communication's packets
20:32:29.668262 IP 172.21.4.2.commplex-main > 192.168.137.128.51162: Flags [.], ack 360, win 235, options [nop,nop,TS val 614597284 ecr 9164198], length 0
20:32:29.674133 IP 192.168.137.128.54779 > 172.21.4.2.8774: Flags [S], seq 239138154, win 14600, options [mss 1460,sackOK,TS val 9164200 ecr 0,nop,wscale 7], length 0
20:32:29.678780 IP 172.21.4.2.8774 > 192.168.137.128.54779: Flags [S.], seq 4231888693, ack 239138155, win 28960, options [mss 1260,sackOK,TS val 614597286 ecr 9164200,nop,wscale 7], length 0
20:32:29.678821 IP 192.168.137.128.54779 > 172.21.4.2.8774: Flags [.], ack 1, win 115, options [nop,nop,TS val 9164203 ecr 614597286], length 0
20:32:29.679051 IP 192.168.137.128.54779 > 172.21.4.2.8774: Flags [P.], seq 1:238, ack 1, win 115, options [nop,nop,TS val 9164203 ecr 614597286], length 237
20:32:29.718431 IP 172.21.4.2.8774 > 192.168.137.128.54779: Flags [.], ack 238, win 235, options [nop,nop,TS val 614597297 ecr 9164203], length 0

**But, When it excuted pkb.py with option parameters...that wasn't response communicatin packets.**
[root@localhost ~]# tcpdump -ni eth0 host 172.21.4.2
tcpdump: verbose output suppressed, use -v or -vv for full protocol decode
listening on eth0, link-type EN10MB (Ethernet), capture size 65535 bytes
(No response w/ target ip)

./pkb.py --cloud=OpenStack --machine_type=m1.medium --image=TestVM --benchmarks=ping --openstack_public_network=net04_ext --openstack_private_network=net04
 ./pkb.py --cloud=OpenStack --benchmarks=unixbench --openstack_tenant=admin --openstack_username=admin --openstack_auth_url=http://172.21.4.2:5000/v2.0/
./pkb.py --cloud=OpenStack --benchmarks=unixbench --os_auth_url=http://172.21.4.2:5000/v2.0/

pkb.log
2016-01-28 20:51:31,619 143950a9 MainThread pkb.py:445 INFO     PerfKitBenchmarker version: v1.0.1-103-g5a2c738
2016-01-28 20:51:32,012 143950a9 MainThread pkb.py:402 INFO     Flag values:
--openstack_tenant=admin
--openstack_username=admin
--openstack_auth_url=http://172.21.4.2:5000/v2.0/
--cloud=OpenStack
--benchmarks=unixbench
2016-01-28 20:51:32,013 143950a9 MainThread publisher.py:524 DEBUG    Using publishers: [<LogPublisher logger=<logging.RootLogger object at 0x7fd2002cc3d0> level=20>, <PrettyPrintStreamPublisher stream=<open file '<stdout>', mode 'w' at 0x7fd207de9150>>, <NewlineDelimitedJSONPublisher file_path="/tmp/perfkitbenchmarker/run_143950a9/perfkitbenchmarker_results.json" mode="wb">]
2016-01-28 20:51:32,129 143950a9 MainThread unixbench(1/1) disk.py:119 INFO     No legacy->new disk type map for provider OpenStack
2016-01-28 20:51:32,486 143950a9 MainThread unixbench(1/1) pkb.py:382 ERROR    Error during benchmark unixbench
Traceback (most recent call last):
  File "/usr/local/bin/PerfKitBenchmarker/perfkitbenchmarker/pkb.py", line 338, in RunBenchmark
    spec.ConstructVirtualMachines()
  File "/usr/local/bin/PerfKitBenchmarker/perfkitbenchmarker/benchmark_spec.py", line 262, in ConstructVirtualMachines
    vm = self._CreateVirtualMachine(vm_spec, os_type, cloud)
  File "/usr/local/bin/PerfKitBenchmarker/perfkitbenchmarker/benchmark_spec.py", line 344, in _CreateVirtualMachine
    return vm_class(vm_spec)
  File "/usr/local/bin/PerfKitBenchmarker/perfkitbenchmarker/providers/openstack/os_virtual_machine.py", line 48, in __init__
    self.firewall = os_network.OpenStackFirewall.GetFirewall()
  File "/usr/local/bin/PerfKitBenchmarker/perfkitbenchmarker/network.py", line 51, in GetFirewall
    benchmark_spec.firewalls[key] = cls()
  File "/usr/local/bin/PerfKitBenchmarker/perfkitbenchmarker/providers/openstack/os_network.py", line 35, in __init__
    self.__nclient = utils.NovaClient()
  File "/usr/local/bin/PerfKitBenchmarker/perfkitbenchmarker/providers/openstack/utils.py", line 116, in __init__
    auth_token=self.__auth.get_token(),
  File "/usr/local/bin/PerfKitBenchmarker/perfkitbenchmarker/providers/openstack/utils.py", line 61, in get_token
    return self.GetConnection().get_token(self.__session)
  File "/usr/local/bin/PerfKitBenchmarker/perfkitbenchmarker/providers/openstack/utils.py", line 47, in GetConnection
    self.__authenticate()
  File "/usr/local/bin/PerfKitBenchmarker/perfkitbenchmarker/providers/openstack/utils.py", line 51, in __authenticate
    import keystoneclient.v2_0.client as ksclient
ImportError: No module named keystoneclient.v2_0.client
2016-01-28 20:51:32,494 143950a9 MainThread unixbench(1/1) pkb.py:510 ERROR    Benchmark 1/1 unixbench (UID: unixbench0) failed. Execution will continue.
2016-01-28 20:51:32,494 143950a9 MainThread unixbench(1/1) pkb.py:516 INFO     Benchmark run statuses:
-----------------------------
Name       UID         Status
-----------------------------
unixbench  unixbench0  FAILED
-----------------------------
Success rate: 0.00% (0/1)
2016-01-28 20:51:32,495 143950a9 MainThread unixbench(1/1) pkb.py:518 INFO     Complete logs can be found at: /tmp/perfkitbenchmarker/run_143950a9/pkb.log

What do I focus of that resolution for perfkit test w/openstack ?

**Comment by voellm** [comment]
@mateusz-blaszkowski @meteorfox Can you of you respond to this.  Thanks.

**Comment by meteorfox** [comment]
@michael92437558 

> File "/usr/local/bin/PerfKitBenchmarker/perfkitbenchmarker/providers/openstack/utils.py", line 51, in __authenticate
import keystoneclient.v2_0.client as ksclient
ImportError: No module named keystoneclient.v2_0.client
2016-01-28 20:51:32,494 143950a9 MainThread unixbench(1/1) pkb.py:510 ERROR Benchmark 1/1 unixbench (UID: unixbench0) failed. Execution will continue.



Seems like you don't have the keystoneclient package with at least `python-keystoneclient==2.0.0`, try upgrading to 2.0.0.

```
pip install -Iv python-keystoneclient==2.0.0
```

Let me know how it goes. :)

**Comment by noahl** [comment]
@meteorfox Do we need to add python-keystoneclient to one of the requirements files? I don't see it in `requirements-openstack.txt` or `requirements.txt`.

**Comment by meteorfox** [comment]
@noahl python-novaclient pulls the keystoneclient package as well. What I'm thinking is that they have an old version of the novaclient which is probably why they have an old version of keystoneclient.

**Comment by meteorfox** [comment]
@noahl We could pin the dependencies to a particular version instead of always getting the latest.

I've tested on my lab with the these and works fine:
```
python-keystoneclient==2.1.1
python-novaclient==2.35.0
```

There are some breaking chanes in In the later versions of novaclient (>3.0), they deprecated the ability to create block storage volumes from the Nova API, now the cinderclient library must be used.

We need to address this sometime soon, but first we need to decide if we are going to change the OpenStack provider to 

- use the [OpenStack CLI ](http://docs.openstack.org/developer/python-openstackclient/) through Subprocess like the other providers, or
- stick to using the python libraries directly like we have been doing

**Comment by skschneider** [comment]
Perhaps in addition to specifying the version, we should have a setup step in PKB that uses pkg_resources to check for required packages and warn/fail if they're not present. A similar check can take place in providers.LoadProvider for the provider-specific requirements file.

**Comment by michael92437558** [comment]
@meteorfox @noahl 

That problem was solved when I installed each clients of keystone&nova 
python-keystoneclient==2.1.1
python-novaclient==2.35.0

Thank u guys

**Comment by noahl** [comment]
@michael92437558 I'm glad you got it working.

@meteorfox @skschneider let's specify the versions in `requirements.txt` as a quick fix. I like the idea of doing a runtime check in the longer-term.

**Comment by noahl** [comment]
@michael92437558 - thanks for closing.

Just for the record, I'd like to say on this bug that #829 and #834 together should prevent this from happening again.
